Name,Descriptions,Latitude,Longitude,infoURL,imageURL
UCSB,A very beautiful university located in Santa Barbara,34.416929,-119.845991,"https://en.wikipedia.org/wiki/University_of_California,_Santa_Barbara",https://th.bing.com/th/id/R.608a30958b8a1741fb444fcd587c0d1a?rik=4AI1FIKcHcvYDA&pid=ImgRaw&r=0
Eureka!,A very tasty American fast food restaurant with a very good spicy fried chicken burger,34.41944953,-119.7000768,https://eurekarestaurantgroup.com/locations/santa-barbara/,https://encrypted-tbn0.gstatic.com/images?q=tbn:ANd9GcTcBYGADYYky995oLYk_TEqn8lr4L6-Go9c3w&usqp=CAU
Santa barbara Airport,A small airport in Santa Barbara where people can choose to make short trips,34.4272485,-119.841318,https://www.flysba.santabarbaraca.gov/?utm_source=FlySBA&utm_medium=Redirect&utm_campaign=ReferralTracking/,
Target,"Students and local residents enjoy shopping for household goods at this supermarket. For students living in the school dormitory, it is easy to go to the supermarket for shopping.",34.42954696,-119.8673224,https://www.target.com/sl/goleta/2872,https://lh5.googleusercontent.com/p/AF1QipOdNeJ7rsOneCNGyPdqGQkk5blckvA8j-NfKr0=w408-h306-k-no
stearns wharf,It is a marina with many seafood spots as well as seafood restaurants nearby. You can also enjoy a very beautiful sea view,34.41008441,-119.6856965,https://stearnswharf.org/,https://lh5.googleusercontent.com/p/AF1QipOYCeqIkODR6T1Bl4LdWVApA20mfTtlZlwmK09U=w408-h272-k-no
South Coast Railroad Museum,"This is such a fun little train museum, that also features a small scale train that you can buy a ticket ($2.50) to ride around the grounds. Great for train lovers, history buffs, kids, or the kids at heart.",34.44325822,-119.8526172,http://scrm.goletadepot.org/,https://lh5.googleusercontent.com/p/AF1QipMmDcX5xXRu8JGzL0VLl37zxBAAEL8zZGBmZP8z=w408-h306-k-no
